{
  "name": "Math Plugins Test Suite",
  "active": false,
  "nodes": [
    {
      "id": "test_add",
      "name": "Test Add",
      "type": "math.add",
      "typeVersion": 1,
      "position": [
        100,
        100
      ],
      "parameters": {
        "numbers": [
          1,
          2,
          3,
          4,
          5
        ]
      }
    },
    {
      "id": "assert_add",
      "name": "Assert Add",
      "type": "test.assert_equals",
      "typeVersion": 1,
      "position": [
        400,
        100
      ],
      "parameters": {
        "actual": "$test_add.result",
        "expected": 15,
        "message": "math.add should sum all numbers"
      }
    },
    {
      "id": "test_multiply",
      "name": "Test Multiply",
      "type": "math.multiply",
      "typeVersion": 1,
      "position": [
        700,
        100
      ],
      "parameters": {
        "numbers": [
          2,
          3,
          4
        ]
      }
    },
    {
      "id": "assert_multiply",
      "name": "Assert Multiply",
      "type": "test.assert_equals",
      "typeVersion": 1,
      "position": [
        100,
        300
      ],
      "parameters": {
        "actual": "$test_multiply.result",
        "expected": 24,
        "message": "math.multiply should multiply all numbers"
      }
    },
    {
      "id": "test_subtract",
      "name": "Test Subtract",
      "type": "math.subtract",
      "typeVersion": 1,
      "position": [
        400,
        300
      ],
      "parameters": {
        "a": 10,
        "b": 3
      }
    },
    {
      "id": "assert_subtract",
      "name": "Assert Subtract",
      "type": "test.assert_equals",
      "typeVersion": 1,
      "position": [
        700,
        300
      ],
      "parameters": {
        "actual": "$test_subtract.result",
        "expected": 7,
        "message": "math.subtract should return a - b"
      }
    },
    {
      "id": "test_divide",
      "name": "Test Divide",
      "type": "math.divide",
      "typeVersion": 1,
      "position": [
        100,
        500
      ],
      "parameters": {
        "a": 20,
        "b": 4
      }
    },
    {
      "id": "assert_divide",
      "name": "Assert Divide",
      "type": "test.assert_equals",
      "typeVersion": 1,
      "position": [
        400,
        500
      ],
      "parameters": {
        "actual": "$test_divide.result",
        "expected": 5,
        "message": "math.divide should return a / b"
      }
    },
    {
      "id": "test_max",
      "name": "Test Max",
      "type": "math.max",
      "typeVersion": 1,
      "position": [
        700,
        500
      ],
      "parameters": {
        "numbers": [
          3,
          7,
          2,
          9,
          1
        ]
      }
    },
    {
      "id": "assert_max",
      "name": "Assert Max",
      "type": "test.assert_equals",
      "typeVersion": 1,
      "position": [
        100,
        700
      ],
      "parameters": {
        "actual": "$test_max.result",
        "expected": 9,
        "message": "math.max should return maximum value"
      }
    },
    {
      "id": "test_min",
      "name": "Test Min",
      "type": "math.min",
      "typeVersion": 1,
      "position": [
        400,
        700
      ],
      "parameters": {
        "numbers": [
          3,
          7,
          2,
          9,
          1
        ]
      }
    },
    {
      "id": "assert_min",
      "name": "Assert Min",
      "type": "test.assert_equals",
      "typeVersion": 1,
      "position": [
        700,
        700
      ],
      "parameters": {
        "actual": "$test_min.result",
        "expected": 1,
        "message": "math.min should return minimum value"
      }
    }
  ],
  "connections": {
    "Test Add": {
      "main": {
        "0": [
          {
            "node": "[object Object]",
            "type": "main",
            "index": 0
          }
        ]
      }
    },
    "Test Multiply": {
      "main": {
        "0": [
          {
            "node": "[object Object]",
            "type": "main",
            "index": 0
          }
        ]
      }
    },
    "Test Subtract": {
      "main": {
        "0": [
          {
            "node": "[object Object]",
            "type": "main",
            "index": 0
          }
        ]
      }
    },
    "Test Divide": {
      "main": {
        "0": [
          {
            "node": "[object Object]",
            "type": "main",
            "index": 0
          }
        ]
      }
    },
    "Test Max": {
      "main": {
        "0": [
          {
            "node": "[object Object]",
            "type": "main",
            "index": 0
          }
        ]
      }
    },
    "Test Min": {
      "main": {
        "0": [
          {
            "node": "[object Object]",
            "type": "main",
            "index": 0
          }
        ]
      }
    }
  },
  "staticData": {},
  "meta": {},
  "settings": {
    "timezone": "UTC",
    "executionTimeout": 3600,
    "saveExecutionProgress": true,
    "saveDataErrorExecution": "all",
    "saveDataSuccessExecution": "all"
  }
}
