{
  "name": "meta.workflow_packages.testing_triangle.label",
  "active": false,
  "nodes": [
    {
      "id": "lint",
      "name": "Lint",
      "type": "tools.run_lint",
      "typeVersion": 1,
      "position": [
        100,
        100
      ],
      "parameters": {
        "path": "src"
      }
    },
    {
      "id": "lint_failed",
      "name": "Lint Failed",
      "type": "utils.branch_condition",
      "typeVersion": 1,
      "position": [
        400,
        100
      ],
      "parameters": {
        "value": "$lint_results",
        "mode": "regex",
        "compare": "(FAILED|ERROR)"
      }
    },
    {
      "id": "lint_ok",
      "name": "Lint Ok",
      "type": "utils.not",
      "typeVersion": 1,
      "position": [
        700,
        100
      ],
      "parameters": {
        "value": "$lint_failed"
      }
    },
    {
      "id": "unit_tests",
      "name": "Unit Tests",
      "type": "tools.run_tests",
      "typeVersion": 1,
      "position": [
        100,
        300
      ],
      "parameters": {
        "path": "tests"
      }
    },
    {
      "id": "unit_failed",
      "name": "Unit Failed",
      "type": "utils.branch_condition",
      "typeVersion": 1,
      "position": [
        400,
        300
      ],
      "parameters": {
        "value": "$unit_results",
        "mode": "regex",
        "compare": "(FAILED|ERROR)"
      }
    },
    {
      "id": "unit_ok",
      "name": "Unit Ok",
      "type": "utils.not",
      "typeVersion": 1,
      "position": [
        700,
        300
      ],
      "parameters": {
        "value": "$unit_failed"
      }
    },
    {
      "id": "ui_tests",
      "name": "Ui Tests",
      "type": "tools.run_tests",
      "typeVersion": 1,
      "position": [
        100,
        500
      ],
      "parameters": {
        "path": "tests/ui"
      }
    }
  ],
  "connections": {
    "Lint": {
      "main": {
        "0": [
          {
            "node": "[object Object]",
            "type": "main",
            "index": 0
          }
        ]
      }
    },
    "Lint Failed": {
      "main": {
        "0": [
          {
            "node": "[object Object]",
            "type": "main",
            "index": 0
          }
        ]
      }
    },
    "Unit Tests": {
      "main": {
        "0": [
          {
            "node": "[object Object]",
            "type": "main",
            "index": 0
          }
        ]
      }
    },
    "Unit Failed": {
      "main": {
        "0": [
          {
            "node": "[object Object]",
            "type": "main",
            "index": 0
          }
        ]
      }
    }
  },
  "staticData": {},
  "meta": {},
  "settings": {
    "timezone": "UTC",
    "executionTimeout": 3600,
    "saveExecutionProgress": true,
    "saveDataErrorExecution": "all",
    "saveDataSuccessExecution": "all"
  }
}
