{
  "name": "default_app_workflow",
  "active": false,
  "nodes": [
    {
      "id": "load_messages",
      "name": "Load Messages",
      "type": "metabuilder.operation",
      "typeVersion": 1,
      "position": [
        100,
        100
      ],
      "parameters": {
        "operation": "load_messages"
      }
    },
    {
      "id": "load_metadata",
      "name": "Load Metadata",
      "type": "metabuilder.operation",
      "typeVersion": 1,
      "position": [
        400,
        100
      ],
      "parameters": {
        "operation": "load_metadata"
      }
    },
    {
      "id": "load_prompts",
      "name": "Load Prompts",
      "type": "metabuilder.operation",
      "typeVersion": 1,
      "position": [
        700,
        100
      ],
      "parameters": {
        "operation": "load_prompts"
      }
    },
    {
      "id": "create_github_client",
      "name": "Create Github Client",
      "type": "metabuilder.operation",
      "typeVersion": 1,
      "position": [
        100,
        300
      ],
      "parameters": {
        "operation": "create_github_client"
      }
    },
    {
      "id": "create_openai_client",
      "name": "Create Openai Client",
      "type": "metabuilder.operation",
      "typeVersion": 1,
      "position": [
        400,
        300
      ],
      "parameters": {
        "operation": "create_openai_client"
      }
    },
    {
      "id": "load_tools",
      "name": "Load Tools",
      "type": "metabuilder.operation",
      "typeVersion": 1,
      "position": [
        700,
        300
      ],
      "parameters": {
        "operation": "load_tools"
      }
    },
    {
      "id": "load_plugins",
      "name": "Load Plugins",
      "type": "metabuilder.operation",
      "typeVersion": 1,
      "position": [
        100,
        500
      ],
      "parameters": {
        "operation": "load_plugins"
      }
    },
    {
      "id": "seed_context",
      "name": "Seed Context",
      "type": "metabuilder.operation",
      "typeVersion": 1,
      "position": [
        400,
        500
      ],
      "parameters": {
        "operation": "seed_context"
      }
    },
    {
      "id": "seed_messages",
      "name": "Seed Messages",
      "type": "metabuilder.operation",
      "typeVersion": 1,
      "position": [
        700,
        500
      ],
      "parameters": {
        "operation": "seed_messages"
      }
    },
    {
      "id": "append_user_instructions",
      "name": "Append User Instructions",
      "type": "metabuilder.operation",
      "typeVersion": 1,
      "position": [
        100,
        700
      ],
      "parameters": {
        "operation": "append_message"
      }
    },
    {
      "id": "ai_loop",
      "name": "Ai Loop",
      "type": "metabuilder.loop",
      "typeVersion": 1,
      "position": [
        400,
        700
      ],
      "parameters": {
        "max_iterations": 10,
        "when": "$no_tool_calls",
        "nodes": [
          {
            "id": "ai_request",
            "type": "operation",
            "op": "ai_request",
            "description": "Make request to AI model"
          },
          {
            "id": "execute_tool_calls",
            "type": "operation",
            "op": "execute_tool_calls",
            "description": "Execute any tool calls from AI response"
          },
          {
            "id": "append_results",
            "type": "operation",
            "op": "append_results",
            "description": "Append tool results to conversation"
          }
        ]
      }
    }
  ],
  "connections": {
    "Load Messages": {
      "main": {
        "0": [
          {
            "node": "[object Object]",
            "type": "main",
            "index": 0
          }
        ]
      }
    },
    "Load Metadata": {
      "main": {
        "0": [
          {
            "node": "[object Object]",
            "type": "main",
            "index": 0
          }
        ]
      }
    },
    "Load Prompts": {
      "main": {
        "0": [
          {
            "node": "[object Object]",
            "type": "main",
            "index": 0
          }
        ]
      }
    },
    "Create Github Client": {
      "main": {
        "0": [
          {
            "node": "[object Object]",
            "type": "main",
            "index": 0
          }
        ]
      }
    },
    "Create Openai Client": {
      "main": {
        "0": [
          {
            "node": "[object Object]",
            "type": "main",
            "index": 0
          }
        ]
      }
    },
    "Load Tools": {
      "main": {
        "0": [
          {
            "node": "[object Object]",
            "type": "main",
            "index": 0
          }
        ]
      }
    },
    "Load Plugins": {
      "main": {
        "0": [
          {
            "node": "[object Object]",
            "type": "main",
            "index": 0
          }
        ]
      }
    },
    "Seed Context": {
      "main": {
        "0": [
          {
            "node": "[object Object]",
            "type": "main",
            "index": 0
          }
        ]
      }
    },
    "Seed Messages": {
      "main": {
        "0": [
          {
            "node": "[object Object]",
            "type": "main",
            "index": 0
          }
        ]
      }
    },
    "Append User Instructions": {
      "main": {
        "0": [
          {
            "node": "[object Object]",
            "type": "main",
            "index": 0
          }
        ]
      }
    }
  },
  "staticData": {},
  "meta": {},
  "settings": {
    "timezone": "UTC",
    "executionTimeout": 3600,
    "saveExecutionProgress": true,
    "saveDataErrorExecution": "all",
    "saveDataSuccessExecution": "all"
  }
}
